{
  "run_id": "fraud-tabular",
  "title": "Chong gian lan the (tabular, temporal split)",
  "objective": "PR-AUC >= 0.55 tren thang eval, chay CPU",
  "spec": "examples/fraud-tabular/spec.md",
  "tasks": [
    {"id": "G1", "kind": "gate", "title": "Lam ro spec: don vi GD, base rate, ngan sach FP"},
    {"id": "A1", "title": "Phan tich du lieu + base rate", "role": "data-analyst", "agent": "codex",
     "deps": ["G1"], "change": "Thong ke 2.1M GD, base rate 0.31%, do chin nhan theo thang; de xuat co mau eval theo don vi GD.",
     "acceptance": "artifacts/A1/data_analysis.md co base rate, split temporal, ke hoach audit leakage."},
    {"id": "A2", "title": "Chot metric chi phi", "role": "requirements-analyst", "agent": "claude",
     "deps": ["G1"], "change": "Chot PR-AUC, chi phi/1000 GD, FPR@recall=0.8 va ngan sach chan nham.",
     "acceptance": "artifacts/A2/requirements.md liet ke metric, nguong, gia dinh nhan tre."},
    {"id": "A3", "title": "Research baseline tabular", "role": "researcher", "agent": "codex",
     "deps": ["G1"], "change": "Baseline boosting + hieu chuan xac suat, tai lieu public.",
     "acceptance": "artifacts/A3/research.md voi nguon va danh gia kha thi."},
    {"id": "F0", "title": "Ceiling C0: do chin nhan + SE", "role": "feasibility-analyst", "agent": "claude",
     "deps": ["A1", "A2", "A3"], "change": "Uoc luong tran tu nhan tre chargeback va SE tren thang eval.",
     "outputs": ["runs/fraud-tabular/ceiling.json"], "owns": ["runs/fraud-tabular/ceiling.json"],
     "acceptance": "ceiling.json co estimates[C0] dang khoang + basis."},
    {"id": "P1", "title": "Phuong an A (boosting + calibration)", "role": "model-proposer", "agent": "claude",
     "deps": ["F0"], "change": "De xuat gradient boosting + hieu chuan, feature as-of.",
     "acceptance": "artifacts/P1/proposal.md co phuong an, chi phi, rui ro."},
    {"id": "P2", "title": "Phuong an B (rule + model nhe)", "role": "model-proposer", "agent": "codex",
     "deps": ["F0"], "change": "De xuat ket hop rule nghiep vu va model nhe.",
     "acceptance": "artifacts/P2/proposal.md co phuong an, chi phi, rui ro."},
    {"id": "P3", "title": "Phan bien", "role": "critic", "agent": "claude",
     "deps": ["P1", "P2"], "change": "Chi ra rui ro drift kenh moi va nhan tre.",
     "acceptance": "artifacts/P3/critique.md"},
    {"id": "P4", "title": "Chot kien truc + DAG", "role": "architect", "agent": "claude",
     "deps": ["P3"], "change": "Judge thong nhat; viet architecture.md va plan.json build.",
     "acceptance": "artifacts/P4/architecture.md va plan.json hop le."},
    {"id": "G2", "kind": "gate", "title": "Duyet plan + nguong chan", "deps": ["P4"]},
    {"id": "G3", "kind": "gate", "title": "Xac nhan tai nguyen train CPU/container", "deps": ["G2"]},
    {"id": "T1", "title": "Train model chong gian lan", "role": "module-dev", "agent": "codex",
     "mode": "train", "resources": {"compute": "cpu", "container": "fraud-xgb-v0.1"},
     "deps": ["G3"], "owns": ["runs/fraud-tabular/model/"],
     "change": "Train boosting tren du lieu den 2024-06, feature as-of, audit leakage.",
     "acceptance": "PR-AUC tren thang eval + eval.json + report day du."},
    {"id": "E1", "title": "Danh gia theo nguong + hieu chuan", "role": "error-analyst", "agent": "claude",
     "mode": "evaluate-only", "resources": {"compute": "cpu"},
     "deps": ["T1"], "owns": ["runs/fraud-tabular/threshold/"],
     "change": "Chon nguong theo chi phi, do calibration, phan cum FP theo kenh.",
     "acceptance": "eval.json + report.md + report.html trong threshold/."},
    {"id": "M1", "title": "Giam sat drift sau release", "role": "error-analyst", "agent": "codex",
     "mode": "monitor", "resources": {"compute": "cpu"},
     "deps": ["E1"], "owns": ["runs/fraud-tabular/monitor/"],
     "change": "Theo doi base rate, PR theo tuan, canh bao drift kenh moi.",
     "acceptance": "monitor/ co bao cao vong dau + nguong canh bao."}
  ]
}
