{
  "run_id": "forecast-timeseries",
  "title": "Du bao nhu cau SKU (rolling-origin)",
  "objective": "MASE <= 0.85 o h=7, coverage 90% trong 85-93%",
  "spec": "examples/forecast-timeseries/spec.md",
  "tasks": [
    {"id": "G1", "kind": "gate", "title": "Lam ro spec: horizon, as-of, audit leakage"},
    {"id": "A1", "title": "Phan tich chuoi + su kien", "role": "data-analyst", "agent": "claude",
     "deps": ["G1"], "change": "Thong ke 800 SKU x 730 ngay, tinh mua vu, khuyen mai, Tet; de xuat rolling-origin 4 folds.",
     "acceptance": "artifacts/A1/data_analysis.md co mua vu, split, ke hoach audit leakage."},
    {"id": "A2", "title": "Chot metric theo horizon", "role": "requirements-analyst", "agent": "codex",
     "deps": ["G1"], "change": "Chot MASE/coverage theo h=1/7/14 va muc tieu kho.",
     "acceptance": "artifacts/A2/requirements.md liet ke metric, horizon, gia dinh khuyen mai."},
    {"id": "A3", "title": "Research baseline mua vu", "role": "researcher", "agent": "claude",
     "deps": ["G1"], "change": "Baseline seasonal naive + mo hinh nhe, tai lieu public.",
     "acceptance": "artifacts/A3/research.md voi nguon va danh gia kha thi."},
    {"id": "F0", "title": "Ceiling C0: nhieu + SE fold", "role": "feasibility-analyst", "agent": "codex",
     "deps": ["A1", "A2", "A3"], "change": "Uoc luong tran tu baseline mua vu va SE tren 4 folds.",
     "outputs": ["runs/forecast-timeseries/ceiling.json"], "owns": ["runs/forecast-timeseries/ceiling.json"],
     "acceptance": "ceiling.json co estimates[C0] dang khoang + basis."},
    {"id": "P1", "title": "Phuong an A (mua vu + hieu chinh)", "role": "model-proposer", "agent": "claude",
     "deps": ["F0"], "change": "De xuat mo hinh mua vu + hieu chinh khuyen mai.",
     "acceptance": "artifacts/P1/proposal.md co phuong an, chi phi, rui ro."},
    {"id": "P2", "title": "Phuong an B (hoc may nhe)", "role": "model-proposer", "agent": "codex",
     "deps": ["F0"], "change": "De xuat mo hinh hoc may nhe voi feature lich.",
     "acceptance": "artifacts/P2/proposal.md co phuong an, chi phi, rui ro."},
    {"id": "P3", "title": "Phan bien", "role": "critic", "agent": "codex",
     "deps": ["P1", "P2"], "change": "Chi ra rui ro Tet/khuyen mai dot xuat.",
     "acceptance": "artifacts/P3/critique.md"},
    {"id": "P4", "title": "Chot kien truc + DAG", "role": "architect", "agent": "claude",
     "deps": ["P3"], "change": "Judge thong nhat; viet architecture.md va plan.json build.",
     "acceptance": "artifacts/P4/architecture.md va plan.json hop le."},
    {"id": "G2", "kind": "gate", "title": "Duyet plan + cach dung du bao", "deps": ["P4"]},
    {"id": "G3", "kind": "gate", "title": "Xac nhan tai nguyen batch CPU", "deps": ["G2"]},
    {"id": "T1", "title": "Fit mo hinh rolling-origin", "role": "module-dev", "agent": "claude",
     "mode": "train", "resources": {"compute": "cpu", "container": "fcst-v0.1"},
     "deps": ["G3"], "owns": ["runs/forecast-timeseries/model/"],
     "change": "Fit tren 4 folds rolling-origin, audit date_max(feature) < origin.",
     "acceptance": "MASE h=7 + eval.json + report day du."},
    {"id": "E1", "title": "Danh gia theo horizon", "role": "error-analyst", "agent": "codex",
     "mode": "evaluate-only", "resources": {"compute": "cpu"},
     "deps": ["T1"], "owns": ["runs/forecast-timeseries/horizon/"],
     "change": "Do MASE/coverage h=1/7/14, phan cum loi promo/Tet.",
     "acceptance": "eval.json + report.md + report.html trong horizon/."}
  ]
}
